id,title,subtitle,description,short_description,syllabus,url,slug,difficulty,created,date_modified,date_published,available,end_date,typical_learning_time,rating,price,new,language,format,license,venue
3Vo3Am1LEeWMPAqsmzmVew,"Developing Data Products",NULL,"A data product is the production output from a statistical analysis. Data products automate complex analysis tasks or use technology to expand the utility of a data informed model, algorithm or inference. This course covers the basics of creating data products using Shiny, R packages, and interactive graphics. The course will focus on the statistical fundamentals of creating a data product that can be used to tell a story about data to a mass audience.",NULL,NULL,http://www.coursera.org/learn/data-products,data-products,NULL,NULL,NULL,NULL,NULL,NULL,,NULL,Free,NULL,en,MOOC,"Coursera specific license",Coursera
t1gZRTXyEeW6RApRXdjJPw,"The Importance of Listening",NULL,"In this second MOOC in the Social Marketing Specialization - ""The Importance of Listening"" - you will go deep into the Big Data of social and gain a more complete picture of what can be learned from interactions on social sites. You will be amazed at just how much information can be extracted from a single post, picture, or video. In this MOOC, guest speakers from Social Gist, BroadReader, Lexalytics, Semantria, Radian6, and IBMs Bluemix and Social Media Analytics Tools (SMA) will join Professor Hlavac to take you through the full range of analytics tools and options available to you and how to get the most from them. The best part, most of them will be available to you through the MOOC for free! Those purchasing the MOOC will receive special tools, templates, and videos to enhance your learning experience. In completing this course you will develop a fuller understanding of the data and will be able to increase the effectiveness of your content strategy by making better decisions and spotting crises before they happen! MOOC 2 bonus content in the paid toolkit includes access to Semantrias analytics engine to extract some data on the markets you are developing and have it analyzed. \n\nNOTE: By enrolling in this course, you will be given access to IBMs Bluemix technology for one month for free as well as Lexalytics Semantria tool. For those earning a Course Certificate, you will be given an additional five months of Bluemix and three months of Semantria at no cost with a special key code generated only for your email address. By enrolling for a Course Certificate for this MOOC, you are acknowledging that your email will be shared with IBM and Lexalytics for the sole and express purpose of generating your individual key code. After the key code has been generated, IBM and Lexalytics will delete your email from its records. \n\nAdditional MOOC 2 faculty include: \n* Steve Dodd (SVP Business Development, Effyis - dba BoardReader and Socialgist - Global Social Media Content Access) \n* Seth Redmore (CMO, Lexalytics, Inc.)\n* Chris Gruber (Social Media Analytics Solution Architect, IBM)\n* Russell Beardall (Cloud Architect, IBM) \n* Tom Collinger (Executive Director Spiegel Research Center and Senior Director Distance Learning, Medill Integrated Marketing Communications, Northwestern)\n* Tressie Lieberman (VP Digital Innovation, Taco Bell)",NULL,NULL,http://www.coursera.org/learn/importance-of-listening,importance-of-listening,NULL,NULL,NULL,NULL,NULL,NULL,"4 weeks of study, 2-4 hours/week",NULL,Free,NULL,en,MOOC,"Coursera specific license",Coursera
FMBvmkIKEeWB_AoW1KYI4Q,"Machine Learning: Recommender Systems & Dimensionality Reduction",NULL,"Case Study: Recommending Products\n\nHow does Amazon recommend products you might be interested in purchasing?  How does Netflix decide which movies or TV shows you might want to watch?  What if you are a new user, should Netflix just recommend the most popular movies?  Who might you form a new link with on Facebook or LinkedIn?  These questions are endemic to most service-based industries, and underlie the notion of collaborative filtering and the recommender systems deployed to solve these problems.  In this fourth case study, you will explore these ideas in the context of recommending products based on customer reviews.  \n\nIn this course, you will explore dimensionality reduction techniques for modeling high-dimensional data.  In the case of recommender systems, your data is represented as user-product relationships, with potentially millions of users and hundred of thousands of products.  You will implement matrix factorization and latent factor models for the task of predicting new user-product relationships.  You will also use side information about products and users to improve predictions.\n\nLearning Outcomes:  By the end of this course, you will be able to:\n   -Create a collaborative filtering system.\n   -Reduce dimensionality of data using SVD, PCA, and random projections.\n   -Perform matrix factorization using coordinate descent.\n   -Deploy latent factor models as a recommender system.\n   -Handle the cold start problem using side information.\n   -Examine a product recommendation application.\n   -Implement these techniques in Python.",NULL,NULL,http://www.coursera.org/learn/ml-recommenders,ml-recommenders,NULL,NULL,NULL,NULL,NULL,NULL,,NULL,Free,NULL,en,MOOC,"Coursera specific license",Coursera
OZSZ6CD-EeWcQw5YiljpGw,"Introduction to Big Data Analytics",NULL,"This course is for novice programmers or business people whod like to understand more advanced tools used to wrangle and analyze big data. In this course you will be guided in basic approaches  to querying and exploring data using higher level tools built on top of a Hadoop Platform.   You will be walked through query interfaces, environments, and the canonical situations for tools like HBASE, HIVE, Pig, as well as more general tools like Spark-SQL.   After this course you will be able to identify the kinds of analysis you can get of big data and how to interpret these results.",NULL,NULL,http://www.coursera.org/learn/bigdata-analytics,bigdata-analytics,NULL,NULL,NULL,NULL,NULL,NULL,"5 weeks of study, 3-5 hours/week",NULL,Free,NULL,en,MOOC,"Coursera specific license",Coursera
X1RtV0EiEeWC4g7VhG4bTQ,"Managing Data Analysis",NULL,"This one-week course describes the process of analyzing data and how to manage that process. We describe the iterative nature of data analysis and the role of stating a sharp question, exploratory data analysis, inference, formal statistical modeling, interpretation, and communication. In addition, we will describe how to direct analytic activities within a team and to drive the data analysis process towards coherent and useful results. \n\nThis is a focused course designed to rapidly get you up to speed on the process of data analysis and how it can be managed. Our goal was to make this as convenient as possible for you without sacrificing any essential content. Weve left the technical information aside so that you can focus on managing your team and moving it forward.\n\nAfter completing this course you will know how to….\n\n1. Describe the basic data analysis iteration\n2. Identify different types of questions and translate them to specific datasets\n3. Describe different types of data pulls\n4. Explore datasets to determine if data are appropriate for a given question\n5. Direct model building efforts in common data analyses\n6. Interpret the results from common data analyses\n7. Integrate statistical findings to form coherent data analysis presentations\n\nCommitment: 1 week of study, 4-6 hours\n\nCourse cover image by fdecomite. Creative Commons BY https://flic.kr/p/4HjmvD",NULL,NULL,http://www.coursera.org/learn/managing-data-analysis,managing-data-analysis,NULL,NULL,NULL,NULL,NULL,NULL,"1 week of study, 4-6 hours",NULL,Free,NULL,en,MOOC,"Coursera specific license",Coursera
3c1bSkIJEeWpogr5ZO8qxQ,"Machine Learning: Classification",NULL,"Case Study: Analysing Sentiment\n\nIn our second case study, analyzing sentiment, you will create models that predict a class (positive/negative sentiment) from input features (text of the reviews, user profile information,...).  This task is an example of classification, one of the most widely used areas of machine learning, with a broad array of applications, including ad targeting, spam detection, medical diagnosis and image classification. \n\nIn this course, you will create classifiers that provide state-of-the-art performance on a variety of tasks.  You will become familiar with some of the most successful techniques, including logistic regression, boosted decision trees and kernelized support vector machines.  In addition, you will be able to design and implement the underlying algorithms that can learn these models at scale.  You will implement these technique on real-world, large-scale machine learning tasks.   \n\nLearning Objectives: By the end of this course, you will be able to:\n   -Describe the input and output of a classification model.\n   -Tackle both binary and multiclass classification problems.\n   -Implement a logistic regression model for large-scale classification.  \n   -Create a non-linear model using decision trees.\n   -Improve the performance of any model using boosting.\n   -Construct non-linear features using kernels.  \n   -Describe the underlying decision boundaries.  \n   -Build a classification model to predict sentiment in a product review dataset.  \n   -Implement these techniques in Python.",NULL,NULL,http://www.coursera.org/learn/ml-classification,ml-classification,NULL,NULL,NULL,NULL,NULL,NULL,,NULL,Free,NULL,en,MOOC,"Coursera specific license",Coursera
uiT8U5oIEeWQGBKrxISOrQ,"Command Line Tools for Genomic Data Science",NULL,"Introduces to the commands that you need to manage and analyze directories, files, and large sets of genomic data. This is the fourth course in the Genomic Big Data Science Specialization from Johns Hopkins University.",NULL,NULL,http://www.coursera.org/learn/genomic-tools,genomic-tools,NULL,NULL,NULL,NULL,NULL,NULL,,NULL,Free,NULL,en,MOOC,"Coursera specific license",Coursera
bGZkCuIJEeSqWiIAC0gGHw,"Digital Analytics for Marketing Professionals: Marketing Analytics in Practice",NULL,"This course builds on the theory and foundations of marketing analytics and focuses on practical application by demystifying the use of data in marketing and helping you realize the power of visualizing data with artful use of numbers found in the digital space.",NULL,NULL,http://www.coursera.org/learn/digital-analytics,digital-analytics,NULL,NULL,NULL,NULL,NULL,NULL,"4 weeks of study, 8-10 hours/week",NULL,Free,NULL,en,MOOC,"Coursera specific license",Coursera
v1-2302,"Data Visualization",NULL,"Learn how to transform information from a format efficient for computation into a format efficient for human perception, cognition, and communication. Explore elements of computer graphics, human-computer interaction, perceptual psychology, and design in addition to data processing and computation.",NULL,NULL,http://www.coursera.org/course/datavisualization,datavisualization,NULL,NULL,NULL,NULL,NULL,NULL,"4-6 hours/week",NULL,Free,NULL,en,MOOC,"Coursera specific license",Coursera
v1-2614,"Applied Logistic Regression",NULL,"This course provides theoretical and practical training on the increasingly popular logistic\nregression model, which has become the standard analytical method for use with a\nbinary response variable.",NULL,NULL,http://www.coursera.org/course/logisticregression,logisticregression,NULL,NULL,NULL,NULL,NULL,NULL,"2-6 hours/week",NULL,Free,NULL,en,MOOC,"Coursera specific license",Coursera
v1-2301,"Text Mining and Analytics",NULL,"Explore algorithms for mining and analyzing big text data to discover interesting patterns, extract useful knowledge, and support decision making.",NULL,NULL,http://www.coursera.org/course/textanalytics,textanalytics,NULL,NULL,NULL,NULL,NULL,NULL,"5-10 hours/week",NULL,Free,NULL,en,MOOC,"Coursera specific license",Coursera
yWjlOBnoEeWg_RJGAuFGjw,"Data Warehouse Concepts, Design, and Data Integration",NULL,"This is the second course in the Data Warehousing for Business Intelligence specialization. Ideally, the courses should be taken in sequence.\n\nIn this course, you will learn exciting concepts and skills for designing data warehouses and creating data integration workflows. \nThese are fundamental skills for data warehouse developers and administrators. You will have hands-on experience for data warehouse design and use open source products for manipulating pivot tables and creating data integration workflows.You will also gain conceptual background about maturity models, architectures, multidimensional models, and management practices, providing an organizational perspective about data warehouse development. If you are currently a business or information technology professional and want to become a data warehouse designer or administrator, this course will give you the knowledge and skills to do that. By the end of the course, you will have the design experience, software background, and organizational context that prepares you to succeed with data warehouse development projects.  \n\nIn this course, you will create data warehouse designs and data integration workflows that satisfy the business intelligence needs of organizations. When you’re done with this course, you’ll be able to:\n   * Evaluate an organization for data warehouse maturity and business architecture alignment;\n   * Create a data warehouse design and reflect on alternative design methodologies and design goals;\n   * Create data integration workflows using prominent open source software;\n   * Reflect on the role of change data, refresh constraints, refresh frequency trade-offs, and data quality goals in data integration process design; and\n   * Perform operations on pivot tables to satisfy typical business analysis requests using prominent open source software",NULL,NULL,http://www.coursera.org/learn/dwdesign,dwdesign,NULL,NULL,NULL,NULL,NULL,NULL,,NULL,Free,NULL,en,MOOC,"Coursera specific license",Coursera
C-WALZ3LEeWVBgpelZA5Jw,"Decision-Making and Scenarios",NULL,"This course is designed to show you how use quantitative models to transform data into better business decisions. You’ll learn both how to use models to facilitate decision-making and also how to structure decision-making for optimum results. Two of Wharton’s most acclaimed professors will show you the step-by-step processes of modeling common business and financial scenarios, so you can significantly improve your ability to structure complex problems and derive useful insights about alternatives. Once you’ve created models of existing realities, possible risks, and alternative scenarios, you can determine the best solution for your business or enterprise, using the decision-making tools and techniques you’ve learned in this course.",NULL,NULL,http://www.coursera.org/learn/wharton-decision-making-scenarios,wharton-decision-making-scenarios,NULL,NULL,NULL,NULL,NULL,NULL,,NULL,Free,NULL,en,MOOC,"Coursera specific license",Coursera
v1-3219,"Understanding China, 1700-2000: A Data Analytic Approach, Part 2",NULL,"The purpose of this course is to summarize new directions in Chinese history and social science produced by the creation and analysis of big historical datasets based on newly opened Chinese archival holdings, and to organize this knowledge in a framework that encourages learning about China in comparative perspective.",NULL,NULL,http://www.coursera.org/course/newchinahistory2,newchinahistory2,NULL,NULL,NULL,NULL,NULL,NULL,"3-4 hours/week",NULL,Free,NULL,en,MOOC,"Coursera specific license",Coursera
v1-94,"Artificial Intelligence Planning",NULL,"The course aims to provide a foundation in artificial intelligence techniques for planning, with an overview of the wide spectrum of different problems and approaches, including their underlying theory and their applications.",NULL,NULL,http://www.coursera.org/course/aiplan,aiplan,NULL,NULL,NULL,NULL,NULL,NULL,"3-8 hours/week",NULL,Free,NULL,en,MOOC,"Coursera specific license",Coursera
9Lnb6D6NEeWBrBIWi3mmCw,"Machine Learning With Big Data",NULL,"Want to learn the basics of large-scale data processing? Need to make predictive models but don’t know the right tools? This course will introduce you to open source tools you can use for parallel, distributed and scalable machine learning.  After completing this course’s hands-on projects with KNIME and Spark, you will be able to train, evaluate, and validate basic predictive models. You will be able to describe and apply common clustering techniques and classification algorithms.",NULL,NULL,http://www.coursera.org/learn/machinelearningwithbigdata,machinelearningwithbigdata,NULL,NULL,NULL,NULL,NULL,NULL,"4 Weeks, 3 - 4 hours per week",NULL,Free,NULL,en,MOOC,"Coursera specific license",Coursera
v1-2354,"Big Data Analytics for Healthcare",NULL,"We introduce the characteristics and related analytic challenges on dealing with clinical data from electronic health records. Many of those insights come from medical informatics community and data mining/machine learning community. There are three thrusts in this course: Application, Algorithm and System",NULL,NULL,http://www.coursera.org/course/bigdataanalytics,bigdataanalytics,NULL,NULL,NULL,NULL,NULL,NULL,,NULL,Free,NULL,en,MOOC,"Coursera specific license",Coursera
nvfMcDxTEeW7GArkqhNhJw,"Capstone: Analyzing (Social) Network Data",NULL,"In this capstone project we’ll combine  all of the skills from all four specialization courses to do something really fun: analyze social networks!  \n\nThe opportunities for learning are practically endless in a social network.  Who are the “influential” members of the network?  What are the sub-communities in the network?   Who is connected to whom, and by how many links?   These are just some of the questions you can explore in this project.\n\nWe will provide you with a real-world data set and some infrastructure for getting started, as well as some warm up tasks and basic project requirements, but then it’ll be up to you where you want to take the project.  If you’re running short on ideas, we’ll have several suggested directions that can help get your creativity and imagination going.  Finally, to integrate the skills you acquired in course 4 (and to show off your project!) you will be asked to create a video showcase of your final product.",NULL,NULL,http://www.coursera.org/learn/intermediate-programming-capstone,intermediate-programming-capstone,NULL,NULL,NULL,NULL,NULL,NULL,,NULL,Free,NULL,en,MOOC,"Coursera specific license",Coursera
tAfppJ3KEeWoKRLkmmHLTQ,"Introduction to Spreadsheets and Models",NULL,"The simple spreadsheet is one of the most powerful data analysis tools that exists, and it’s available to almost anyone. Major corporations and small businesses alike use spreadsheet models to determine where key measures of their success are now, and where they are likely to be in the future. But in order to get the most out of a spreadsheet, you have know how to use it. This course is designed to give you an introduction to basic spreadsheet tools and formulas so that you can begin harness the power of spreadsheets to map the data you have now and to predict the data you may have in the future. Through short, easy-to-follow demonstrations, you’ll learn how to use Excel or Sheets so that you can begin to build models and decision trees in future courses in this Specialization. \nBasic familiarity with, and access to, Excel or Sheets is required.",NULL,NULL,http://www.coursera.org/learn/wharton-introduction-spreadsheets-models,wharton-introduction-spreadsheets-models,NULL,NULL,NULL,NULL,NULL,NULL,,NULL,Free,NULL,en,MOOC,"Coursera specific license",Coursera
Gyll8Zh9EeWZyg6bf_Oxkw,"Algorithms for DNA Sequencing",NULL,"We will learn computational methods -- algorithms and data structures -- for analyzing DNA sequencing data. We will learn a little about DNA, genomics, and how DNA sequencing is used.  We will use Python to implement key algorithms and data structures and to analyze real genomes and DNA sequencing datasets.",NULL,NULL,http://www.coursera.org/learn/dna-sequencing,dna-sequencing,NULL,NULL,NULL,NULL,NULL,NULL,,NULL,Free,NULL,en,MOOC,"Coursera specific license",Coursera
v1-7,"Natural Language Processing",NULL,"In this class, you will learn fundamental algorithms and mathematical models for processing natural language, and how these can be used to solve practical problems.",NULL,NULL,http://www.coursera.org/course/nlp,nlp,NULL,NULL,NULL,NULL,NULL,NULL,"8-10 hours/week",NULL,Free,NULL,en,MOOC,"Coursera specific license",Coursera
sxQd3zI6EeWtEArDRuZAUQ,"Communicating Data Science Results",NULL,"Important note: The second assignment in this course covers the topic of Graph Analysis in the Cloud, in which you will use Elastic MapReduce and the Pig language to perform graph analysis over a moderately large dataset, about 600GB. In order to complete this assignment, you will need to make use of Amazon Web Services (AWS). Amazon has generously offered to provide up to $50 in free AWS credit to each learner in this course to allow you to complete the assignment. Further details regarding the process of receiving this credit are available in the welcome message for the course, as well as in the assignment itself. Please note that Amazon, University of Washington, and Coursera cannot reimburse you for any charges if you exhaust your credit.\n\nWhile we believe that this assignment contributes an excellent learning experience in this course, we understand that some learners may be unable or unwilling to use AWS. We are unable to issue Course Certificates for learners who do not complete the assignment that requires use of AWS. As such, you should not pay for a Course Certificate in Communicating Data Results if you are unable or unwilling to use AWS, as you will not be able to successfully complete the course without doing so.\n\nMaking predictions is not enough!  Effective data scientists know how to explain and interpret their results, and communicate findings accurately to stakeholders to inform business decisions.  Visualization is the field of research in computer science that studies effective communication of quantitative results by linking perception, cognition, and algorithms to exploit the enormous bandwidth of the human visual cortex.  In this course you will learn to recognize, design, and use effective visualizations.\n\nJust because you can make a prediction and convince others to act on it doesn’t mean you should.  In this course you will explore the ethical considerations around big data and how these considerations are beginning to influence policy and practice.   You will learn the foundational limitations of using technology to protect privacy and the codes of conduct emerging to guide the behavior of data scientists.  You will also learn the importance of reproducibility in data science and how the commercial cloud can help support reproducible research even for experiments involving massive datasets, complex computational infrastructures, or both.\n\nLearning Goals: After completing this course, you will be able to:\n1. Design and critique visualizations\n2. Explain the state-of-the-art in privacy, ethics, governance around big data and data science\n3. Use cloud computing to analyze large datasets in a reproducible way.",NULL,NULL,http://www.coursera.org/learn/data-results,data-results,NULL,NULL,NULL,NULL,NULL,NULL,,NULL,Free,NULL,en,MOOC,"Coursera specific license",Coursera
EGOMPEacEeWcUBKKSpC5MQ,"Data Science at Scale - Capstone Project",NULL,"In the capstone, students will engage on a real world project requiring them to apply skills from the entire data science pipeline: preparing, organizing, and transforming data, constructing a model, and evaluating results.    Through a collaboration with Coursolve, each Capstone project is associated with partner stakeholders who have a vested interest in your results and are eager to deploy them in practice.  These projects will not be straightforward and the outcome is not prescribed -- you will need to tolerate ambiguity and negative results!  But we believe the experience will be rewarding and will better prepare you for data science projects in practice.",NULL,NULL,http://www.coursera.org/learn/datasci-capstone,datasci-capstone,NULL,NULL,NULL,NULL,NULL,NULL,,NULL,Free,NULL,en,MOOC,"Coursera specific license",Coursera
GdzorjsjEeWFSA6UPWxRyQ,"Graph Analytics for Big Data",NULL,"Want to understand your data network structure and how it changes under different conditions? Curious to know how to identify closely interacting clusters within a graph? Have you heard of the fast-growing area of graph analytics and want to learn more? This course gives you a broad overview of the field of graph analytics so you can learn new ways to model, store, retrieve and analyze graph-structured data.\n\nAfter completing this course, you will be able to model a problem into a graph database and perform analytical tasks over the graph in a scalable manner.  Better yet, you will be able to apply these techniques to understand the significance of your data sets for your own projects.",NULL,NULL,http://www.coursera.org/learn/graph-analytics,graph-analytics,NULL,NULL,NULL,NULL,NULL,NULL,"4 Weeks, 3 - 5 hours per week",NULL,Free,NULL,en,MOOC,"Coursera specific license",Coursera
