id,title,subtitle,description,short_description,syllabus,url,slug,difficulty,created,date_modified,date_published,available,end_date,typical_learning_time,rating,price,new,language,format,license,venue
KXOLVTovEeWnxw5wP_KHTw,"Introduction to Big Data",NULL,"What’s the “hype” surrounding the Big Data phenomenon? Who are these mysterious data scientists everyone is talking about? What kinds of problem-solving skills and knowledge should they have? What kinds of problems can be solved by Big Data technology? \nAfter this short introductory course you will have answers to all these questions. Additionally, you will start to become proficient with the key technical terms and big data tools and applications to prepare you for a deep dive into the rest of the courses in the Big Data specialization. \nEach day, our society creates 2.5 quintillion bytes of data (that’s 2.5 followed by 18 zeros). With this flood of data the need to unlock actionable value becomes more acute, rapidly increasing demand for Big Data skills and qualified data scientists.\n\nHands-On Assignment Hardware and Software Requirements\nSoftware\nWindows 7+, Mac OS X 10.10+, Ubuntu 14.04+ or CentOS 6+ VirtualBox 5+\n\nHardware\nQuad Core Processor (VT-x or AMD-V support recommended), 64-bit\n8 GB Ram\n20 GB disk free\n\nHow to find your hardware information:\nWindows: Open System by clicking the Start button, right-clicking Computer, and then clicking Properties\nMac: Open Overview by clicking on the Apple menu and clicking “About This Mac”\n\nMost computers with 8 GB RAM purchased in the last 3 years will meet the minimum requirements.\n\nInternet connection\nAccess to broadband connection to download the 4 GB Cloudera QuickStart VM from: \nhttp://www.cloudera.com/content/www/en-us/downloads/quickstart_vms/5-4.html?src=Coursera",NULL,NULL,http://www.coursera.org/learn/intro-to-big-data,intro-to-big-data,NULL,NULL,NULL,NULL,NULL,NULL,"3 weeks of study, 5-6 hours/week",NULL,Free,NULL,en,MOOC,"Coursera specific license",Coursera
Rr2thkIKEeWZtA4u62x6lQ,"Machine Learning Capstone: An Intelligent Application with Deep Learning",NULL,"Have you ever wondered how a product recommender is built?  How you can infer the underlying sentiment from reviews?  How you can extract information from images to find visually-similar products to recommend?  How you construct an application that does all of these things in real time, and provides a front-end user experience?  That’s what you will build in this course!\n\nUsing what you’ve learned about machine learning thus far, you will build a general product recommender system that does much more than just find similar products  You will combine images of products with product descriptions and their reviews to create a truly innovative intelligent application.\n\nYou’ve probably heard that Deep Learning is making news across the world as one of the most promising techniques in machine learning, especially for analyzing image data. With every industry dedicating resources to unlock the deep learning potential, to be competitive, you will want to use these models in tasks such as image tagging, object recognition, speech recognition, and text analysis.  In this capstone, you will build deep learning models using neural networks, explore what they are, what they do, and how.  To remove the barrier introduced by designing, training, and tuning networks, and to be able to achieve high performance with less labeled data, you will also build deep learning classifiers tailored to your specific task using pre-trained models, which we call deep features.  \n\nAs a core piece of this capstone project, you will implement a deep learning model for image-based product recommendation.  You will then combine this visual model with text descriptions of products and information from reviews to build an exciting, end-to-end intelligent application that provides a novel product discovery experience.  You will then deploy it as a service, which you can share with your friends and potential employers.  \n\nLearning Outcomes:  By the end of this capstone, you will be able to:\n   -Explore a dataset of products, reviews and images.\n   -Build a product recommender.\n   -Describe how a neural network model is represented and how it encodes non-linear features.\n   -Combine different types of layers and activation functions to obtain better performance.\n   -Use pretrained models, such as deep features, for new classification tasks. \n   -Describe how these models can be applied in computer vision, text analytics and speech recognition.  \n   -Use visual features to find the products your users want.\n   -Incorporate review sentiment into the recommendation.\n   -Build an end-to-end application.\n   -Deploy it as a service.  \n   -Implement these techniques in Python.",NULL,NULL,http://www.coursera.org/learn/ml-capstone,ml-capstone,NULL,NULL,NULL,NULL,NULL,NULL,,NULL,Free,NULL,en,MOOC,"Coursera specific license",Coursera
rc5KG0aUEeWG1w6arGoEIQ,"Accounting Analytics",NULL,"Accounting Analytics explores how financial statement data and non-financial metrics can be linked to financial performance.  In this course, taught by Wharton’s acclaimed accounting professors, you’ll learn how data is used to assess what drives financial performance and to forecast future financial scenarios. While many accounting and financial organizations deliver data, accounting analytics deploys that data to deliver insight, and this course will explore the many areas in which accounting data provides insight into other business areas including consumer behavior predictions, corporate strategy, risk management, optimization, and more. By the end of this course, you’ll understand how financial data and non-financial data interact to forecast events, optimize operations, and determine strategy. This course has been designed to help you make better business decisions about the emerging roles of accounting analytics, so that you can apply what you’ve learned to make your own business decisions and create strategy using financial data. ",NULL,NULL,http://www.coursera.org/learn/accounting-analytics,accounting-analytics,NULL,NULL,NULL,NULL,NULL,NULL,"4 weeks, 3 -5 hours per week",NULL,Free,NULL,en,MOOC,"Coursera specific license",Coursera
v1-174,"Discrete Optimization",NULL,"Tired of solving Sudokus by hand? This class teaches you how to solve complex search problems with discrete optimization concepts and algorithms, including constraint programming, local search, and mixed-integer programming.",NULL,NULL,http://www.coursera.org/course/optimization,optimization,NULL,NULL,NULL,NULL,NULL,NULL,"10-20 hours/week",NULL,Free,NULL,en,MOOC,"Coursera specific license",Coursera
ENhHCTboEeW8ZAoCexam_w,"Data Analysis Tools",NULL,"In this course, you will develop and test hypotheses about your data. You will learn a variety of statistical tests, as well as strategies to know how to apply the appropriate one to your specific data and question. Using your choice of two powerful statistical software packages (SAS or Python), you will explore ANOVA, Chi-Square, and Pearson correlation analysis. This course will guide you through basic statistical principles to give you the tools to answer questions you have developed. Throughout the course, you will share your progress with others to gain valuable feedback and provide insight to other learners about their work.",NULL,NULL,http://www.coursera.org/learn/data-analysis-tools,data-analysis-tools,NULL,NULL,NULL,NULL,NULL,NULL,,NULL,Free,NULL,en,MOOC,"Coursera specific license",Coursera
Gtv4Xb1-EeS-ViIACwYKVQ,"Machine Learning",NULL,"Machine learning is the science of getting computers to act without being explicitly programmed. In the past decade, machine learning has given us self-driving cars, practical speech recognition, effective web search, and a vastly improved understanding of the human genome. Machine learning is so pervasive today that you probably use it dozens of times a day without knowing it. Many researchers also think it is the best way to make progress towards human-level AI. In this class, you will learn about the most effective machine learning techniques, and gain practice implementing them and getting them to work for yourself. More importantly, youll learn about not only the theoretical underpinnings of learning, but also gain the practical know-how needed to quickly and powerfully apply these techniques to new problems. Finally, youll learn about some of Silicon Valleys best practices in innovation as it pertains to machine learning and AI.\n\nThis course provides a broad introduction to machine learning, datamining, and statistical pattern recognition. Topics include: (i) Supervised learning (parametric/non-parametric algorithms, support vector machines, kernels, neural networks). (ii) Unsupervised learning (clustering, dimensionality reduction, recommender systems, deep learning). (iii) Best practices in machine learning (bias/variance theory; innovation process in machine learning and AI). The course will also draw from numerous case studies and applications, so that youll also learn how to apply learning algorithms to building smart robots (perception, control), text understanding (web search, anti-spam), computer vision, medical informatics, audio, database mining, and other areas.\n\n\nCan I earn a Course Certificate if I completed this course before they were available?\nIn order to verify one’s identity and maintain academic integrity, learners who completed assignments or quizzes for Machine Learning prior to November 1st will need to redo and resubmit these assessments in order to earn a Course Certificate. To clarify, both quizzes and programming assignments need to be resubmitted. Though your deadlines may have technically passed, please be assured that you may resubmit both types of assessments at any time. We apologize for the inconvenience and appreciate your patience as we strive to ensure the integrity and value of our certificates. \n\nPlease note that, in order to earn a Course Certificate, you must complete the course within 180 days of payment, or by May 1, 2016, whichever is earlier.",NULL,NULL,http://www.coursera.org/learn/machine-learning,machine-learning,NULL,NULL,NULL,NULL,NULL,NULL,,NULL,Free,NULL,en,MOOC,"Coursera specific license",Coursera
P--h6zpNEeWYbg7p2_3OHQ,"Python Data Structures",NULL,"This course will introduce the core data structures of the Python programming language. We will move past the basics of procedural programming and explore how we can use the Python built-in data structures such as lists, dictionaries, and tuples to perform increasingly complex data analysis. This course will cover Chapters 6-10 of the textbook “Python for Informatics”.  This course is equivalent to the second half of the 11-week ""Programming for Everybody (Python)"" course.",NULL,NULL,http://www.coursera.org/learn/python-data,python-data,NULL,NULL,NULL,NULL,NULL,NULL,"2-4 hours/week",NULL,Free,NULL,en,MOOC,"Coursera specific license",Coursera
v1-1973,"The Caltech-JPL Summer School on Big Data Analytics",NULL,"This is an intensive, advanced summer school (in the sense used by scientists) in some of the methods of computational, data-intensive science.  It covers a variety of topics from applied computer science and engineering, and statistics, and it requires a strong background in computing, statistics, and data-intensive research.\n",NULL,NULL,http://www.coursera.org/course/bigdataschool,bigdataschool,NULL,NULL,NULL,NULL,NULL,NULL,"20-25 hours/week",NULL,Free,NULL,en,MOOC,"Coursera specific license",Coursera
mUSYT5noEeWqkw5zNB248Q,"Bioconductor for Genomic Data Science",NULL,"Learn to use tools from the Bioconductor project to perform analysis of genomic data. This is the fifth course in the Genomic Big Data Specialization from Johns Hopkins University.",NULL,NULL,http://www.coursera.org/learn/bioconductor,bioconductor,NULL,NULL,NULL,NULL,NULL,NULL,,NULL,Free,NULL,en,MOOC,"Coursera specific license",Coursera
v1-896,"Mining Massive Datasets",NULL,"This class teaches algorithms for extracting models and other information from very large amounts of data.  The emphasis is on techniques that are efficient and that scale well.",NULL,NULL,http://www.coursera.org/course/mmds,mmds,NULL,NULL,NULL,NULL,NULL,NULL,"8-10 hours/week",NULL,Free,NULL,en,MOOC,"Coursera specific license",Coursera
OmgIw0C2EeWZtA4u62x6lQ,"Qualitative Research Methods",NULL,"In this course you will be introduced to the basic ideas behind the qualitative research in social science. You will learn about data collection, description, analysis and interpretation in qualitative research. Qualitative research often involves an iterative process. We will focus on the ingredients required for this process: data collection and analysis.\nYou wont learn how to use qualitative methods by just watching videos, so we put much stress on collecting data through observation and interviewing and on analysing and interpreting the collected data in other assignments.\nObviously, the most important concepts in qualitative research will be discussed, just as we will discuss quality criteria, good practices, ethics, writing some methods of analysis, and mixing methods.\nWe hope to take away some prejudice, and enthuse many students for qualitative research.",NULL,NULL,http://www.coursera.org/learn/qualitative-methods,qualitative-methods,NULL,NULL,NULL,NULL,NULL,NULL,"8 weeks of study, 4-6 hours/week",NULL,Free,NULL,en,MOOC,"Coursera specific license",Coursera
a_xPWXNVEeWxvQr3acyajw,"Regression Models",NULL,"Linear models, as their name implies, relates an outcome to a set of predictors of interest using linear assumptions.  Regression models, a subset of linear models, are the most important statistical analysis tool in a data scientist’s toolkit. This course covers regression analysis, least squares and inference using regression models. Special cases of the regression model, ANOVA and ANCOVA will be covered as well. Analysis of residuals and variability will be investigated. The course will cover modern thinking on model selection and novel uses of regression models including scatterplot smoothing.",NULL,NULL,http://www.coursera.org/learn/regression-models,regression-models,NULL,NULL,NULL,NULL,NULL,NULL,,NULL,Free,NULL,en,MOOC,"Coursera specific license",Coursera
GplkvRnqEeW9dA4X94-nLQ,"Managing Big Data with MySQL",NULL,"This course is an introduction to how to use relational databases in business analysis.  You will learn how relational databases work, and how to use entity-relationship diagrams to display the structure of the data held within them.  This knowledge will help you understand how data needs to be collected in business contexts, and help you identify features you want to consider if you are involved in implementing new data collection efforts.  You will also learn how to execute the most useful query and table aggregation statements for business analysts, and practice using them with real databases. No more waiting 48 hours for someone else in the company to provide data to you – you will be able to get the data by yourself!\n\nBy the end of this course, you will have a clear understanding of how relational databases work, and have a portfolio of queries you can show potential employers. Businesses are collecting increasing amounts of information with the hope that data will yield novel insights into how to improve businesses. Analysts that understand how to access this data – this means you! – will have a strong competitive advantage in this data-smitten business world.",NULL,NULL,http://www.coursera.org/learn/analytics-mysql,analytics-mysql,NULL,NULL,NULL,NULL,NULL,NULL,"5 weeks, 3 - 5 hours per week",NULL,Free,NULL,en,MOOC,"Coursera specific license",Coursera
v1-329,"Statistics: Making Sense of Data",NULL,"This course is an introduction to the key ideas and principles\nof the collection, display, and analysis of data to guide you in making\nvalid and appropriate conclusions about the world.",NULL,NULL,http://www.coursera.org/course/introstats,introstats,NULL,NULL,NULL,NULL,NULL,NULL,"6-8 hours/week",NULL,Free,NULL,en,MOOC,"Coursera specific license",Coursera
6JyoHjVOEeWBMQ5pdIoFkQ,"Data Management and Visualization",NULL,"Whether being used to customize advertising to millions of website visitors or streamline inventory ordering at a small restaurant, data is becoming more integral to success. Too often, we’re not sure how use data to find answers to the questions that will make us more successful in what we do. In this course, you will discover what data is and think about what questions you have that can be answered by the data – even if you’ve never thought about data before. Based on existing data, you will learn to develop a research question, describe the variables and their relationships, calculate basic statistics, and present your results clearly. By the end of the course, you will be able to use powerful data analysis tools – either SAS or Python – to manage and visualize your data, including how to deal with missing data, variable groups, and graphs. Throughout the course, you will share your progress with others to gain valuable feedback, while also learning how your peers use data to answer their own questions.",NULL,NULL,http://www.coursera.org/learn/data-visualization,data-visualization,NULL,NULL,NULL,NULL,NULL,NULL,"4 weeks of study,  4-5 hours/week",NULL,Free,NULL,en,MOOC,"Coursera specific license",Coursera
v1-145,"Web Intelligence and Big Data",NULL,"This course is about building web-intelligence applications exploiting big data sources arising social media, mobile devices and sensors, using new big-data platforms based on the map-reduce parallel programming paradigm. In the past, this course has been offered at the Indian Institute of Technology Delhi as well as the Indraprastha Institute of Information Technology Delhi.",NULL,NULL,http://www.coursera.org/course/bigdata,bigdata,NULL,NULL,NULL,NULL,NULL,NULL,"3-4 hours/week",NULL,Free,NULL,en,MOOC,"Coursera specific license",Coursera
v1-394,"Social and Economic Networks:  Models and Analysis",NULL,"Learn how to model social and economic networks and their impact on human behavior.  How do networks form, why do they exhibit certain patterns, and how does their structure impact diffusion, learning, and other behaviors?   We will bring together models and techniques from economics, sociology, math, physics, statistics and computer science to answer these questions.  ",NULL,NULL,http://www.coursera.org/course/networksonline,networksonline,NULL,NULL,NULL,NULL,NULL,NULL,"3-6 hours/week",NULL,Free,NULL,en,MOOC,"Coursera specific license",Coursera
xRA5cxnoEeWg_RJGAuFGjw,"Relational Database Support for Data Warehouses",NULL,"Relational Database Support for Data Warehouses is the third course in the Data Warehousing for Business Intelligence specialization. In this course, youll use analytical elements of SQL for answering business intelligence questions. Youll learn features of relational database management systems for managing summary data commonly used in business intelligence reporting. Because of the importance and difficulty of managing implementations of data warehouses, well also delve into storage architectures, scalable parallel processing, data governance, and big data impacts.",NULL,NULL,http://www.coursera.org/learn/dwrelational,dwrelational,NULL,NULL,NULL,NULL,NULL,NULL,,NULL,Free,NULL,en,MOOC,"Coursera specific license",Coursera
u41Z-k3PEeWjfw5p9aPb_w,"Mathematical Biostatistics Boot Camp 2",NULL,"Learn fundamental concepts in data analysis and statistical inference, focusing on one and two independent samples.",NULL,NULL,http://www.coursera.org/learn/biostatistics-2,biostatistics-2,NULL,NULL,NULL,NULL,NULL,NULL,,NULL,Free,NULL,en,MOOC,"Coursera specific license",Coursera
2QKA3X3EEeW-FwqtbgSK1Q,"Measuring Causal Effects in the Social Sciences",NULL,"How can we know if the differences in wages between men and women are caused by discrimination or differences in background characteristics? In this course we look at causal effects as opposed to spurious relationships. We will discuss how they can be identified in the social sciences using quantitative data, and describe how this can help us understand social mechanisms.",NULL,NULL,http://www.coursera.org/learn/measuring-causal-effects,measuring-causal-effects,NULL,NULL,NULL,NULL,NULL,NULL,,NULL,Free,NULL,en,MOOC,"Coursera specific license",Coursera
KkFXzUXEEeWb8RJf7Z1H0w,"Operations Analytics",NULL,"This course is designed to impact the way you think about transforming data into better decisions. Recent extraordinary improvements in data-collecting technologies have changed the way firms make informed and effective business decisions. The course on operations analytics, taught by three of Wharton’s leading experts, focuses on how the data can be used to profitably match supply with demand in various business settings. In this course, you will learn how to model future demand uncertainties, how to predict the outcomes of competing policy choices and how to choose the best course of action in the face of risk. The course will introduce frameworks and ideas that provide insights into a spectrum of real-world business challenges, will teach you methods and software available for tackling these challenges quantitatively as well as the issues involved in gathering the relevant data.",NULL,NULL,http://www.coursera.org/learn/wharton-operations-analytics,wharton-operations-analytics,NULL,NULL,NULL,NULL,NULL,NULL,"4 weeks of study, 2-3 hours/week",NULL,Free,NULL,en,MOOC,"Coursera specific license",Coursera
UCBrJjb0EeWw6g4yTrGrVQ,"Data Analysis and Interpretation Capstone",NULL,"The Capstone project will allow you to continue to apply and refine the data analytic techniques learned from the previous courses in the Specialization to address an important issue in society. You will use real world data to complete a project with our industry and academic partners. A major component of the Capstone project is for you to be able to choose the information from your analyses that best conveys results and implications, and to tell a compelling story with this information. You will report your findings in a professional quality report that can be shown to colleagues and potential employers to demonstrate the skills you learned by completing the Specialization.",NULL,NULL,http://www.coursera.org/learn/data-analysis-capstone,data-analysis-capstone,NULL,NULL,NULL,NULL,NULL,NULL,,NULL,Free,NULL,en,MOOC,"Coursera specific license",Coursera
v1-188,"Passion Driven Statistics",NULL,"With existing data, you will develop skills in data analysis and basic statistics by exploring your own research question.",NULL,NULL,http://www.coursera.org/course/pdstatistics,pdstatistics,NULL,NULL,NULL,NULL,NULL,NULL,"3-4 hours/week",NULL,Free,NULL,en,MOOC,"Coursera specific license",Coursera
hwiBZm0vEeWbyw5d8C-Blw,"Exploratory Data Analysis",NULL,"This course covers the essential exploratory techniques for summarizing data. These techniques are typically applied before formal modeling commences and can help inform the development of more complex statistical models. Exploratory techniques are also important for eliminating or sharpening potential hypotheses about the world that can be addressed by the data. We will cover in detail the plotting systems in R as well as some of the basic principles of constructing data graphics. We will also cover some of the common multivariate statistical techniques used to visualize high-dimensional data.",NULL,NULL,http://www.coursera.org/learn/exploratory-data-analysis,exploratory-data-analysis,NULL,NULL,NULL,NULL,NULL,NULL,,NULL,Free,NULL,en,MOOC,"Coursera specific license",Coursera
olJcuUKiEeWKOBLv1z6n9w,"Introduction to People Analytics",NULL,"This course is designed to provide you with an understanding of the role of data and technology in human capital management. Every topic in the course will be covered in the most practical way so that learners get hands-on experience. In the course we use the 4Ts principle: Task, Theory, Technique and Technology so that there is always a connection to organizational performance objectives, an overview of underlying theories and principles, and specific tools which help achieve business objectives.

You will learn 
●\twhat combination of data, technologies, and tools can be used in people management processes to improve organization’s performance
●\thow to use some of these tools and how to select the ones that suit your objectives and budget
●\tto design individual and team development plans and measure its ROI for the organization
●\thow to figure out the qualities that lead employees to their best performance so you know what to encourage in current and look for in new employees
●\thow to identify the right channels to recruit your employees or team members
●\twhat combination of monetary and non-monetary motivation tools work best for your organization 
●\thow to predict what people will leave in the near future and how to make sure some of them stay
●\thow to measure engagement and make a strong organizational culture improve performance",NULL,NULL,http://www.coursera.org/learn/people-analytics,people-analytics,NULL,NULL,NULL,NULL,NULL,NULL,"7 weeks of study, 1-3 hours/week",NULL,Free,NULL,en,MOOC,"Coursera specific license",Coursera
