id,title,subtitle,description,short_description,syllabus,url,slug,difficulty,created,date_modified,date_published,available,end_date,typical_learning_time,rating,price,new,language,format,license,venue
Xy2quTeOEeWJaxK5AT4frw,"Case studies in business analytics with ACCENTURE",NULL,"Who is this course for ?\nThis course is RESTRICTED TO LEARNERS ENROLLED IN  Strategic Business Analytics SPECIALIZATION as a preparation to the capstone project. During the first two MOOCs, we focused on specific techniques for specific applications. Instead, with this third MOOC, we provide you with different examples  to open your mind to different applications from different industries and sectors.\nThe objective is to give you an helicopter overview on whats happening in this field. You will see how the tools presented in the two previous courses of the Specialization are used in real life projects. \nWe want to ignite your reflection process. Hence, you will best make use of the Accenture cases by watching first the MOOC and then investigate by yourself on the different concepts, industries, or challenges that are introduced during the videos.\n\nAt the end of this course learners will be able to: \n- identify the possible applications of business analytics,\n- hence, reflect on the possible solutions and added-value applications that could be proposed for their capstone project.\n\nThe cases will be presented by senior practitioners from Accenture with different backgrounds in term of industry, function, and country.  Special attention will be paid to the ""value case"" of the issue raised to prepare you for the capstone project of the specialization.\n\nAbout Accenture\nAccenture is a leading global professional services company, providing a broad range of services and solutions in strategy, consulting, digital, technology and operations. Combining unmatched experience and specialized skills across more than 40 industries and all business functions—underpinned by the world’s largest delivery network—Accenture works at the intersection of business and technology to help clients improve their performance and create sustainable value for their stakeholders. With more than 358,000 people serving clients in more than 120 countries, Accenture drives innovation to improve the way the world works and lives. Visit us at www.accenture.com.",NULL,NULL,http://www.coursera.org/learn/case-studies-business-analytics-accenture,case-studies-business-analytics-accenture,NULL,NULL,NULL,NULL,NULL,NULL,,NULL,Free,NULL,en,MOOC,"Coursera specific license",Coursera
v1-2803,"Practical Learning Analytics",NULL,"Everyone in education has questions – Practical Learning Analytics is about answering them. To be practical, we’ll focus on data every university records; to keep things interesting, we’ll examine questions raised by many audiences; to ensure impact, we’ll provide realistic data and example code. ",NULL,NULL,http://www.coursera.org/course/pla,pla,NULL,NULL,NULL,NULL,NULL,NULL,"2-8 hours/week",NULL,Free,NULL,en,MOOC,"Coursera specific license",Coursera
XEjjlXEkEeWhZxJhllGpHQ,"Introduction to Search Engine Optimization",NULL,"Learn the foundational elements of how search engines work, how the SEO landscape has changed and what you can expect in the future. You will learn core SEO strategies and tactics used to drive more organic search results to a specific website or set of websites, as well as tactics to avoid to prevent penalization from search engines. You will also learn how to position yourself for a successful career in SEO.",NULL,NULL,http://www.coursera.org/learn/search-engine-optimization,search-engine-optimization,NULL,NULL,NULL,NULL,NULL,NULL,,NULL,Free,NULL,en,MOOC,"Coursera specific license",Coursera
8LAp90EaEeWZtA4u62x6lQ,"Building a Data Science Team",NULL,"Data science is a team sport. As a data science executive it is your job to recruit, organize, and manage the team to success. In this one-week course, we will cover how you can find the right people to fill out your data science team, how to organize them to give them the best chance to feel empowered and successful, and how to manage your team as it grows. \n\nThis is a focused course designed to rapidly get you up to speed on the process of building and managing a data science team. Our goal was to make this as convenient as possible for you without sacrificing any essential content. Weve left the technical information aside so that you can focus on managing your team and moving it forward.\n\nAfter completing this course you will know.\n\n1. The different roles in the data science team including data scientist and data engineer\n2. How the data science team relates to other teams in an organization\n3. What are the expected qualifications of different data science team members\n4. Relevant questions for interviewing data scientists\n5. How to manage the onboarding process for the team\n6. How to guide data science teams to success\n7. How to encourage and empower data science teams\n\nCommitment: 1 week of study, 4-6 hours\n\nCourse cover image by JaredZammit. Creative Commons BY-SA. https://flic.kr/p/5vuWZz",NULL,NULL,http://www.coursera.org/learn/build-data-science-team,build-data-science-team,NULL,NULL,NULL,NULL,NULL,NULL,"1 week of study, 4-6 hours",NULL,Free,NULL,en,MOOC,"Coursera specific license",Coursera
NNe5CEW4EeW8ow5lHOiKYQ,"Business Analytics Capstone",NULL,"The Business Analytics Capstone Project gives you the opportunity to apply what youve learned about how to make data-driven decisions to a real business challenge faced by Yahoo, a global technology company. At the end of this Capstone, youll be able to ask the right questions of the data, and know how to use data effectively to address business challenges of your own. You’ll understand how cutting-edge businesses use data to optimize marketing, maximize revenue, make operations efficient, and make hiring and management decisions so that you can apply these strategies to your own company or business. Designed with Yahoo to give you invaluable experience in evaluating and creating data-driven decisions, the Business Analytics Capstone Project provides the chance for you to devise a plan of action for optimizing data itself to provide key insights and analysis, and to describe the interaction between key financial and non-financial indicators in Yahoos strategy. Once you complete your analysis of Yahoos actions, youll be better prepared to make better data-driven business decisions of your own.",NULL,NULL,http://www.coursera.org/learn/wharton-capstone-analytics,wharton-capstone-analytics,NULL,NULL,NULL,NULL,NULL,NULL,,NULL,Free,NULL,en,MOOC,"Coursera specific license",Coursera
rwRs6Tn9EeWJaxK5AT4frw,"Capstone: Retrieving, Processing, and Visualizing Data with Python",NULL,"In the capstone, students will build a series of applications to retrieve, process and visualize data using Python.   The projects will involve all the elements of the specialization.  In the first part of the capstone, students will do the same visualizations to become familiar with the technologies in use (Excel, and D3.js) and then will pursue their own project to visualize some other data that they have or can find.   Chapter 15 from the book “Python for Informatics” will serve as the backbone for the capstone.",NULL,NULL,http://www.coursera.org/learn/python-capstone,python-capstone,NULL,NULL,NULL,NULL,NULL,NULL,,NULL,Free,NULL,en,MOOC,"Coursera specific license",Coursera
v1-2633,"Big Data Science with the BD2K-LINCS Data Coordination and Integration Center",NULL,"Learn various methods of analysis including: unsupervised clustering, gene-set enrichment analyses, Bayesian integration, network visualization, and supervised machine learning applications to LINCS data and other relevant Big Data from high content molecular and phenotype profiling of human cells.",NULL,NULL,http://www.coursera.org/course/bd2klincs,bd2klincs,NULL,NULL,NULL,NULL,NULL,NULL,"4-5 hours/week",NULL,Free,NULL,en,MOOC,"Coursera specific license",Coursera
2y_2_3REEeWKsgrp3VnvAw,"Data Science Capstone",NULL,"The capstone project class will allow students to create a usable/public data product that can be used to show your skills to potential employers. Projects will be drawn from real-world problems and will be conducted with industry, government, and academic partners.",NULL,NULL,http://www.coursera.org/learn/data-science-project,data-science-project,NULL,NULL,NULL,NULL,NULL,NULL,"4-9 hours/week",NULL,Free,NULL,en,MOOC,"Coursera specific license",Coursera
sQB40x47EeWS6wrbVw_uEw,"Understanding Clinical Research: Behind the Statistics",NULL,"If you’ve ever skipped over`the results section of a medical paper because terms like “confidence interval” or “p-value” go over your head, then you’re in the right place. You may be a clinical practitioner reading research articles to keep up-to-date with developments in your field or a medical student wondering how to approach your own research. Greater confidence in understanding statistical analysis and the results can benefit both working professionals and those undertaking research themselves. \n\nIf you are simply interested in properly understanding the published literature or if you are embarking on conducting your own research, this course is your first step. It offers an easy entry into interpreting common statistical concepts without getting into nitty-gritty mathematical formulae. To be able to interpret and understand these concepts is the best way to start your journey into the world of clinical literature. That’s where this course comes in - so let’s get started!\n\nThe course is free to enroll and take. You will be offered the option of purchasing a certificate of completion which you become eligible for, if you successfully complete the course requirements. This can be an excellent way of staying motivated!  Financial Aid is also available.",NULL,NULL,http://www.coursera.org/learn/clinical-research,clinical-research,NULL,NULL,NULL,NULL,NULL,NULL,"6 weeks of study, 2-3 hours/week",NULL,Free,NULL,en,MOOC,"Coursera specific license",Coursera
qLFYrxnoEeWwrBKfKrqlSQ,"Database Management Essentials",NULL,"Database Management Essentials provides the foundation you need for a career in database development, data warehousing, or business intelligence, as well as for the entire Data Warehousing for Business Intelligence specialization. In this course, you will create relational databases, write SQL statements to extract information to satisfy business reporting requests, create entity relationship diagrams (ERDs) to design databases, and analyze table designs for excessive redundancy. As you develop these skills, you will use either Oracle or MySQL to execute SQL statements and a database diagramming tool such as the ER Assistant to create ERDs. We’ve designed this course to ensure a common foundation for specialization learners. Everyone taking the course can jump right in with writing SQL statements in Oracle or MySQL.",NULL,NULL,http://www.coursera.org/learn/database-management,database-management,NULL,NULL,NULL,NULL,NULL,NULL,"7 weeks of study, 4-6 hours/week",NULL,Free,NULL,en,MOOC,"Coursera specific license",Coursera
3mA6QTIyEeWsOA5fzAmxbw,"Practical Predictive Analytics: Models and Methods",NULL,"Statistical experiment design and analytics are at the heart of data science.  In this course you will design statistical experiments and analyze the results using modern methods.  You will also explore the common pitfalls in interpreting statistical arguments, especially those associated with big data.  Collectively, this course will help you internalize a core set of practical and effective machine learning methods and concepts, and apply them to solve some real world problems.\n\n  \nLearning Goals: After completing this course, you will be able to:\n1. Design effective experiments and analyze the results\n2. Use resampling methods to make clear and bulletproof statistical arguments without invoking esoteric notation\n3. Explain and apply a core set of classification methods of increasing complexity (rules, trees, random forests), and associated optimization methods (gradient descent and variants)\n4. Explain and apply a set of unsupervised learning concepts and methods\n5. Describe the common idioms of large-scale graph analytics, including structural query, traversals and recursive queries, PageRank, and community detection",NULL,NULL,http://www.coursera.org/learn/predictive-analytics,predictive-analytics,NULL,NULL,NULL,NULL,NULL,NULL,"4 weeks of study, 6-8 hours/week",NULL,Free,NULL,en,MOOC,"Coursera specific license",Coursera
iSxVEG07EeW3YxLB1q9I2w,"The Data Scientist’s Toolbox",NULL,"In this course you will get an introduction to the main tools and ideas in the data scientists toolbox. The course gives an overview of the data, questions, and tools that data analysts and data scientists work with. There are two components to this course. The first is a conceptual introduction to the ideas behind turning data into actionable knowledge. The second is a practical introduction to the tools that will be used in the program like version control, markdown, git, GitHub, R, and RStudio.",NULL,NULL,http://www.coursera.org/learn/data-scientists-tools,data-scientists-tools,NULL,NULL,NULL,NULL,NULL,NULL,"1-4 hours/week",NULL,Free,NULL,en,MOOC,"Coursera specific license",Coursera
Anu7oplDEeWqkw5zNB248Q,"Statistics for Genomic Data Science",NULL,"An introduction to the statistics behind the most popular genomic data science projects. This is the sixth course in the Genomic Big Data Science Specialization from Johns Hopkins University.",NULL,NULL,http://www.coursera.org/learn/statistical-genomics,statistical-genomics,NULL,NULL,NULL,NULL,NULL,NULL,,NULL,Free,NULL,en,MOOC,"Coursera specific license",Coursera
v1-1073,"Introduction to Natural Language Processing",NULL,"This course provides an introduction to the field of Natural Language Processing, including topics like Language Models, Parsing, Semantics, Question Answering, and Sentiment Analysis.\n",NULL,NULL,http://www.coursera.org/course/nlpintro,nlpintro,NULL,NULL,NULL,NULL,NULL,NULL,"7-10 hours/week",NULL,Free,NULL,en,MOOC,"Coursera specific license",Coursera
uFdYfrMiEeWoKQ4rUD57pQ,"Wharton Business and Financial Modeling Capstone",NULL,"In this Capstone you will recommend a business strategy based on a data models you’ve constructed. Using a dataset from Wharton Research Data Services (WRDS), you will implement quantitative models in spreadsheets to identify the best opportunities for success and minimizing risk. Using your newly acquired decision-making skills, you will structure a decision and present this course of action in a professional quality PowerPoint presentation which includes both data and data analysis from your quantitative models.\n\nWharton Research Data Services (WRDS) is the leading data research platform and business intelligence tool for over 30,000 corporate, academic, government and nonprofit clients in 33 countries. WRDS provides the user with one location to access over 200 terabytes of data across multiple disciplines including Accounting, Banking, Economics, ESG, Finance, Insurance, Marketing, and Statistics.",NULL,NULL,http://www.coursera.org/learn/wharton-business-financial-modeling-capstone,wharton-business-financial-modeling-capstone,NULL,NULL,NULL,NULL,NULL,NULL,,NULL,Free,NULL,en,MOOC,"Coursera specific license",Coursera
v1-429,"Case-Based Introduction to Biostatistics",NULL,"Learn to frame and address health-related questions using modern biostatistics ideas and methods.",NULL,NULL,http://www.coursera.org/course/casebasedbiostat,casebasedbiostat,NULL,NULL,NULL,NULL,NULL,NULL,"4-6 hours/week",NULL,Free,NULL,en,MOOC,"Coursera specific license",Coursera
v1-223,"Linear and Discrete Optimization",NULL,"The course is an introduction to linear and discrete optimization - an important part of computational mathematics with a wide range of applications in many areas of everyday life.",NULL,NULL,http://www.coursera.org/course/linearopt,linearopt,NULL,NULL,NULL,NULL,NULL,NULL,"3-6 hours/week",NULL,Free,NULL,en,MOOC,"Coursera specific license",Coursera
UEk5ZkEWEeWC4g7VhG4bTQ,"A Crash Course in Data Science",NULL,"By now you have definitely heard about data science and big data. In this one-week class, we will provide a crash course in what these terms mean and how they play a role in successful organizations. This class is for anyone who wants to learn what all the data science action is about, including those who will eventually need to manage data scientists. The goal is to get you up to speed as quickly as possible on data science without all the fluff. Weve designed this course to be as convenient as possible without sacrificing any of the essentials.\n\nThis is a focused course designed to rapidly get you up to speed on the field of data science. Our goal was to make this as convenient as possible for you without sacrificing any essential content. Weve left the technical information aside so that you can focus on managing your team and moving it forward.\n\nAfter completing this course you will know. \n\n1. How to describe the role data science plays in various contexts\n2. How statistics, machine learning, and software engineering play a role in data science\n3. How to describe the structure of a data science project\n4. Know the key terms and tools used by data scientists\n5. How to identify a successful and an unsuccessful data science project\n3. The role of a data science manager\n\n\nCourse cover image by r2hox. Creative Commons BY-SA: https://flic.kr/p/gdMuhT",NULL,NULL,http://www.coursera.org/learn/data-science-course,data-science-course,NULL,NULL,NULL,NULL,NULL,NULL,"1 week of study, 4-6 hours",NULL,Free,NULL,en,MOOC,"Coursera specific license",Coursera
tla9taD_EeSt6SIACzgCKw,"Introduction to Recommender Systems",NULL,"Recommender systems have changed the way people find products, information, and even other people. They study patterns of behavior to know what someone will prefer from among a collection of things he has never experienced. The technology behind recommender systems has evolved over the past 20 years into a rich collection of tools that enable the practitioner or researcher to develop effective recommenders. We will study the most important of those tools, including how they work, how to use them, how to evaluate them, and their strengths and weaknesses in practice.\n\nThe algorithms we will study include content-based filtering, user-user collaborative filtering, item-item collaborative filtering, dimensionality reduction, and interactive critique-based recommenders. The approach will be hands-on, with six week projects, each of which will involve implementation and evaluation of some type of recommender.\n\nIn addition to topical lectures, this course includes interviews and guest lectures with experts from both academia and industry.\n\nBeginning in February 2015, you will be able to earn a Verified Certificate by verifying your identity via a webcam and a government-issued ID. This option will provide formal recognition of your achievements in the course and includes the University of Minnesota logo. Before then, you can complete a “test run” of the exam. You can then re-take the exam after the Verified Certificate becomes available. For information regarding Verified Certificates, see https://courserahelp.zendesk.com/hc/en-us/articles/201212399-Verified-Certificates",NULL,NULL,http://www.coursera.org/learn/recommender-systems,recommender-systems,NULL,NULL,NULL,NULL,NULL,NULL,"80-120 hours of videos and quizzes",NULL,Free,NULL,en,MOOC,"Coursera specific license",Coursera
v1-96,"Computational Methods for Data Analysis",NULL,"<div>Exploratory and objective data analysis methods applied to the physical, engineering, and biological sciences.</div>\n<div></div>",NULL,NULL,http://www.coursera.org/course/compmethods,compmethods,NULL,NULL,NULL,NULL,NULL,NULL,"10-12 hours/week",NULL,Free,NULL,en,MOOC,"Coursera specific license",Coursera
v1-1327,"Preparing for the AP* Statistics Exam",NULL,"This course is designed for high school students preparing to take the AP* Statistics Exam.\n\n* AP Statistics is a registered trademark of the College Board, which was not involved in the production of, and does not endorse, this product.",NULL,NULL,http://www.coursera.org/course/apstat,apstat,NULL,NULL,NULL,NULL,NULL,NULL,"8-10 hours/week",NULL,Free,NULL,en,MOOC,"Coursera specific license",Coursera
-zhQFJezEeWjfxIrc5BW9Q,"Introduction to Genomic Technologies",NULL,"This course introduces you to the basic biology of modern genomics and the experimental tools that we use to measure it. Well introduce the Central Dogma of Molecular Biology and cover how next-generation sequencing can be used to measure DNA, RNA, and epigenetic patterns. Youll also get an introduction to the key concepts in computing and data science that youll need to understand how data from next-generation sequencing experiments are generated and analyzed.  \n\nThis is the first course in the Genomic Data Science Specialization.",NULL,NULL,http://www.coursera.org/learn/introduction-genomics,introduction-genomics,NULL,NULL,NULL,NULL,NULL,NULL,,NULL,Free,NULL,en,MOOC,"Coursera specific license",Coursera
XUoQOTbqEeWoUw6Yc8vnEw,"Regression Modeling in Practice",NULL,"This course focuses on one of the most important tools in your data analysis arsenal: regression analysis. Using either SAS or Python, you will begin with linear regression and then learn how to adapt when two variables do not present a clear linear relationship. You will examine multiple predictors of your outcome and be able to identify confounding variables, which can tell a more compelling story about your results. You will learn the assumptions underlying regression analysis, how to interpret regression coefficients, and how to use regression diagnostic plots and other tools to evaluate the quality of your regression model. Throughout the course, you will share with others the regression models you have developed and the stories they tell you.",NULL,NULL,http://www.coursera.org/learn/regression-modeling-practice,regression-modeling-practice,NULL,NULL,NULL,NULL,NULL,NULL,"4 weeks, 4 - 5 hours per week",NULL,Free,NULL,en,MOOC,"Coursera specific license",Coursera
qi9mnkIJEeWC4g7VhG4bTQ,"Machine Learning Foundations: A Case Study Approach",NULL,"Do you have data and wonder what it can tell you?  Do you need a deeper understanding of the core ways in which machine learning can improve your business?  Do you want to be able to converse with specialists about anything from regression and classification to deep learning and recommender systems?\n\nIn this course, you will get hands-on experience with machine learning from a series of practical case-studies.  At the end of the first course you will have studied how to predict house prices based on house-level features, analyze sentiment from user reviews, retrieve documents of interest, recommend products, and search for images.  Through hands-on practice with these use cases, you will be able to apply machine learning methods in a wide range of domains.\n\nThis first course treats the machine learning method as a black box.  Using this abstraction, you will focus on understanding tasks of interest, matching these tasks to machine learning tools, and assessing the quality of the output. In subsequent courses, you will delve into the components of this black box by examining models and algorithms.  Together, these pieces form the machine learning pipeline, which you will use in developing intelligent applications.\n\nLearning Outcomes:  By the end of this course, you will be able to:\n   -Identify potential applications of machine learning in practice.  \n   -Describe the core differences in analyses enabled by regression, classification, and clustering.\n   -Select the appropriate machine learning task for a potential application.  \n   -Apply regression, classification, clustering, retrieval, recommender systems, and deep learning.\n   -Represent your data as features to serve as input to machine learning models. \n   -Assess the model quality in terms of relevant error metrics for each task.\n   -Utilize a dataset to fit a model to analyze new data.\n   -Build an end-to-end application that uses machine learning at its core.  \n   -Implement these techniques in Python.",NULL,NULL,http://www.coursera.org/learn/ml-foundations,ml-foundations,NULL,NULL,NULL,NULL,NULL,NULL,"6 weeks of study, 5-8 hours/week",NULL,Free,NULL,en,MOOC,"Coursera specific license",Coursera
